Column1,company,experience,min_exp,max_exp,salary,location,joblisted(days_ago),postedin,rating,reviews_count,details,salary_data_provide_by,base_salary,max_salary,salary_disclosed,Exp_Pattern
Data Analyst - Customer Service,Human Potential Consultant,8-13 Yrs,8,13,₹ 5.1 - 9.2L/yr (AmbitionBox estimate),Mumbai,17,Naukri,0,0,"Power Bi, Data Management, Data Analysis",Estimated by Ambition Box,510000,920000,1,Range (X-Y yrs)
Data Analyst,Bold Business,3-8 Yrs,3,8,Not Disclosed,Remote,17,Naukri,0,0,"Analytical skills, Industry research, Sales",Unknown,360000,1330000,0,Range (X-Y yrs)
Data Analyst,GRAVEYTECH CATERING VENTURES PRIVATE LIMITED,1-5 Yrs,1,5,Not Disclosed,"Mumbai, Bangalore / Bengaluru",17,Naukri,0,0,"Power BI, NoSQL databases, MySQL",Unknown,360000,1330000,0,Range (X-Y yrs)
Manager / AVP - Data Analyst (FATCA),Edge In Asia Recruitment,7-12 Yrs,7,12,Not Disclosed,Bangalore / Bengaluru,17,Naukri,0,0,"Financial Services, Power Bi, CRS",Unknown,360000,1330000,0,Range (X-Y yrs)
Data Analyst,Pavan Laxmikant Giri,0-5 Yrs,0,5,₹ 5.5 - 12L/yr,"Pune, Hyderabad / Secunderabad, Mumbai",17,Naukri,0,0,"Data Science, Data Mining, Data Extraction",Salary Listed by Company,550000,1200000,1,Range (X-Y yrs)
Data Analyst| 5+ yrs exp| Mumbai,Gryphon Hytech Services,5-9 Yrs,5,9,₹ 1.8 - 26.5L/yr (AmbitionBox estimate),Mumbai,18,Naukri,0,0,"Power Bi, Data Analysis, Tableau",Estimated by Ambition Box,180000,2650000,1,Range (X-Y yrs)
Data Analyst,Outsized South Africa (pty) Ltd,2-5 Yrs,2,5,₹ 0.24 - 14L/yr (AmbitionBox estimate),Mumbai,18,Naukri,0,0,"Data Science, Excel, Financial Services",Estimated by Ambition Box,24000,1400000,1,Range (X-Y yrs)
Target - Senior Data Analyst - Data Visualization Tools (5-8 yrs),Hirist.tech,5-8 Yrs,5,8,Not Disclosed,Bangalore / Bengaluru,18,hirist,0,0,"Data Analyst, Data Analytics, DOMO Tool",Unknown,360000,1330000,0,Range (X-Y yrs)
Manager/AVP/Data Analyst - FATCA (7-15 yrs),Edge In Asia Recruitment Private Limited,7-15 Yrs,7,15,Not Disclosed,Bangalore / Bengaluru,18,iimjobs,0,0,"Data Analytics, Analytics, Data Visualization",Unknown,360000,1330000,0,Range (X-Y yrs)
Data Analyst,Value Innovation,5-10 Yrs,5,10,₹ 10 - 20L/yr,Delhi/Ncr,18,Naukri,0,0,"SSIS Packages, Maintenance of ETL Jobs, Data Management and Analytics",Salary Listed by Company,1000000,2000000,1,Range (X-Y yrs)
Data Analyst,Planet Pci Infotech Ltd.,2-5 Yrs,2,5,₹ 5 - 7L/yr,Gurgaon / Gurugram,18,Naukri,0,0,"Statistical Modeling, Data Analytics, Python",Salary Listed by Company,500000,700000,1,Range (X-Y yrs)
Senior Data Analyst,Xoom Inc,4-6 Yrs,4,6,Not Disclosed,"Chennai, Bangalore / Bengaluru",18,Naukri,0,0,"Analytical, Finance, Senior Data Analyst",Unknown,360000,1330000,0,Range (X-Y yrs)
Data Analyst - Urgent Opening (Immediate To 15 days joiners only),Value Innovation,5-8 Yrs,5,8,₹ 0.1 - 13.3L/yr (AmbitionBox estimate),"Delhi/Ncr, Gurgaon / Gurugram, Noida",18,Naukri,0,0,"Data models, ETL, SSIS",Estimated by Ambition Box,10000,1330000,1,Range (X-Y yrs)
Data Analysts / HTML Editor,Ace Soft Export,0-4 Yrs,0,4,Not Disclosed,Rajkot,330,Naukri,3.8,8,"HTML, XML, Adobe Acrobat",Unknown,360000,1330000,0,Range (X-Y yrs)
Platform Data Analyst,Saltmine,2-4 Yrs,2,4,Not Disclosed,Bangalore / Bengaluru,120,Naukri,4.7,3,"Data Analyst, Outsourcing, Procurement",Unknown,360000,1330000,0,Range (X-Y yrs)
Product Research & Data Analyst,Russell Investments Pvt Ltd,2-3 Yrs,2,3,Not Disclosed,Mumbai,120,Naukri,4.7,3,"Asset management, Analytical, Excel",Unknown,360000,1330000,0,Range (X-Y yrs)
Lead Data Analyst,Saltmine,4-7 Yrs,4,7,Not Disclosed,Bangalore / Bengaluru,240,Naukri,4.7,3,"Analytics, Procurement, Data processing",Unknown,360000,1330000,0,Range (X-Y yrs)
Data Analysts / HTML Editor,Ace Soft Export,0-4 Yrs,0,4,Not Disclosed,Rajkot,330,Naukri,3.8,8,"HTML, XML, Adobe Acrobat",Unknown,360000,1330000,0,Range (X-Y yrs)
Data Analyst (ETL Tools),Alpha Analytics Services Pvt Ltd,2-4 Yrs,2,4,₹ 3 - 4.3L/yr (AmbitionBox estimate),Pune,1460,Naukri,5,1,"Data Analyst, SQL, Informatica",Estimated by Ambition Box,300000,430000,1,Range (X-Y yrs)
Analyst Open End Coding,Alpha Analytics Services Pvt Ltd,4-9 Yrs,4,9,Not Disclosed,Pune,1460,Naukri,5,1,"Coding, Data Analyst, Analytics",Unknown,300000,430000,0,Range (X-Y yrs)
Data Reporting Analyst - Tableau/Alteryx - financial Data,Mastermind Network,4-7 Yrs,4,7,Not Disclosed,Gurgaon / Gurugram,18,Naukri,0,0,"Data Manipulation, Portfolio Analysis, Data Analysis",Unknown,360000,1330000,0,Range (X-Y yrs)
Data Reporting Analyst - Portfolio Management,Mastermind Network,4-7 Yrs,4,7,Not Disclosed,Gurgaon / Gurugram,18,Naukri,0,0,"Data Manipulation, Portfolio Analysis, Data Analysis",Unknown,360000,1330000,0,Range (X-Y yrs)
Requirement For Senior Data Analyst in Jaipur,Shadow Placements,5-10 Yrs,5,10,₹ 8 - 15L/yr,"Gurgaon / Gurugram, Noida, Jaipur",19,Naukri,0,0,"Business Intelligence, Data Mining, Data Extraction",Salary Listed by Company,800000,1500000,1,Range (X-Y yrs)
Data Analyst - Business Intelligence,Allegis Group,4-8 Yrs,4,8,Not Disclosed,Bangalore Rural,19,Naukri,0,0,"Data Analysis, Tableau, Data Analytics",Unknown,360000,1330000,0,Range (X-Y yrs)
Returnee programs -Senior Financial Data Analyst(Moody's),Somani Technologies,1-3 Yrs,1,3,Not Disclosed,Bangalore / Bengaluru,19,Naukri,0,0,"Credit Analysis, Financial data analyst, Financial Analysis",Unknown,360000,1330000,0,Range (X-Y yrs)
Data Analyst,Abhramu Tech Solutions,2-4 Yrs,2,4,₹ 3.75 - 5L/yr,Chennai,19,Naukri,0,0,"Data Validation, Power Bi, Data Management",Salary Listed by Company,375000,500000,1,Range (X-Y yrs)
Business / Data Analyst,ElectricPe,5-7 Yrs,5,7,Not Disclosed,Bangalore / Bengaluru,270,Naukri,3.1,27,"SQL, Python, Business intelligence",Unknown,360000,1330000,0,Range (X-Y yrs)
Senior Data Analyst,Adventus.io,3-5 Yrs,3,5,Not Disclosed,Pune,300,Naukri,3.3,18,"SQL, Stakeholder management, Data Analyst",Unknown,360000,1330000,0,Range (X-Y yrs)
Data Analyst,Adventus.io,2-4 Yrs,2,4,Not Disclosed,Pune,365,Naukri,3.3,18,"Analytics, SQL, Automation",Unknown,360000,1330000,0,Range (X-Y yrs)
Data Analyst,Wadhwani AI,2-5 Yrs,2,5,Not Disclosed,Mumbai,365,Naukri,3.1,18,"SQL, Javascript, XML",Unknown,360000,1330000,0,Range (X-Y yrs)
DATA ANALYST,Zero Gravity photography,3-8 Yrs,3,8,Not Disclosed,Chennai,365,Naukri,3.4,15,"Data analysis, Business reporting, Data Analyst",Unknown,360000,1330000,0,Range (X-Y yrs)
Data Analyst Associate,ZOBELLO,1-2 Yrs,1,2,Not Disclosed,New Delhi,2190,Naukri,5,2,"Tools, Data analysis, Data mining",Unknown,360000,1330000,0,Range (X-Y yrs)
Data Analyst Associate,ZOBELLO,1-2 Yrs,1,2,Not Disclosed,New Delhi,2920,Naukri,5,2,"data analysis, data mining, adobe",Unknown,360000,1330000,0,Range (X-Y yrs)
Data Analyst Associate,ZOBELLO,1-6 Yrs,1,6,Not Disclosed,"New Delhi, New Delhi",2920,Naukri,5,2,"adobe, spss, microsoft excel",Unknown,360000,1330000,0,Range (X-Y yrs)
Shell - Data Scientist - Data Modeling & Analytics (3-7 yrs),Hirist.tech,3-7 Yrs,3,7,Not Disclosed,Bangalore / Bengaluru,20,hirist,0,0,"AWS, Data Modeling, Data Science",Unknown,360000,1330000,0,Range (X-Y yrs)
Target - Senior Data Scientist - Supply Chain Domain (4-8 yrs),Hirist.tech,4-8 Yrs,4,8,Not Disclosed,Bangalore / Bengaluru,20,hirist,0,0,"Data Science, Data Scientist, Python",Unknown,360000,1330000,0,Range (X-Y yrs)
Sr. Data Analyst,Instatalent Recruit Llp,12-21 Yrs,12,21,Not Disclosed,Gurgaon / Gurugram,20,Naukri,0,0,"Power Bi, Data Analysis, Data Visualization",Unknown,360000,1330000,0,Range (X-Y yrs)
Data Management - Data Analyst-IT I,Varite,3-6 Yrs,3,6,₹ 6.5 - 10L/yr (AmbitionBox estimate),Bangalore / Bengaluru,20,Naukri,0,0,"Technical services, Data management, SQL database",Estimated by Ambition Box,650000,1000000,1,Range (X-Y yrs)
CW Data Analyst III,Varite,0-8 Yrs,0,8,Not Disclosed,Bangalore / Bengaluru,20,Naukri,0,0,"Operations research, Email marketing, Staffing",Unknown,650000,1000000,0,Range (X-Y yrs)
Data Analyst,Xoom Inc,0-2 Yrs,0,2,Not Disclosed,"Chennai, Bangalore / Bengaluru",20,Naukri,0,0,"Data analysis, Analytical, Manager Technology",Unknown,360000,1330000,0,Range (X-Y yrs)
Business Analyst & Data Analyst (Data Science SQL Python),Techgimini,0-1 Yrs,0,1,₹ 4.75 - 7.5L/yr,Pune,20,Naukri,0,0,"Crm Systems, ERP, System Analysis",Salary Listed by Company,475000,750000,1,Range (X-Y yrs)
"Fresher, Graduate, Recruitment, HR, MBA, Marketing, Communication",Iplace Consultant,0-2 Yrs,0,2,₹ 2 - 5L/yr,"Pune, Delhi/Ncr, Mumbai",20,Naukri,0,0,"BBA, BPO, Calling",Salary Listed by Company,200000,500000,1,Range (X-Y yrs)
Data Analyst - US MNC (analytics),Aspyra Hr Services,3-8 Yrs,3,8,₹ 15 - 30L/yr,"Delhi/Ncr, Gurgaon / Gurugram, Noida",20,Naukri,0,0,"Business Intelligence, hql, Business Analytics",Salary Listed by Company,1500000,3000000,1,Range (X-Y yrs)
Data Analyst,Evify,4-6 Yrs,4,6,Not Disclosed,Surat,120,Naukri,4.3,4,"sql, python, r",Unknown,360000,1330000,0,Range (X-Y yrs)
Data Analyst,P. S International HR Consultants,0-4 Yrs,0,4,Not Disclosed,Mumbai,365,Naukri,4.6,3,"SQL, Networking, Automation",Unknown,360000,1330000,0,Range (X-Y yrs)
Sr. Data Analyst,Bobble App,2-7 Yrs,2,7,Not Disclosed,"Bangalore / Bengaluru, Gurgaon / Gurugram",1460,Naukri,3.5,11,"Data analysis, SQL, Analytical",Unknown,360000,1330000,0,Range (X-Y yrs)
Data Analyst | Lower Parel,Transformatrix Global,2-7 Yrs,2,7,₹ 15 - 20L/yr,Mumbai,22,Naukri,0,0,"Power Bi, Data Analysis, Big Data",Salary Listed by Company,1500000,2000000,1,Range (X-Y yrs)
Data Analyst,Rocket Fast Recruiter,10-20 Yrs,10,20,₹ 90 - 225L/yr,Canada,22,Naukri,0,0,"Data Transformation, Data Enrichment, Data Wrangling",Salary Listed by Company,9000000,22500000,1,Range (X-Y yrs)
Email Marketing Executive,Giri Consultancy,1-5 Yrs,1,5,₹ 1 - 7.5L/yr (AmbitionBox estimate),"Noida, New Delhi",22,Naukri,0,0,"email marketer, Email Marketing, bulk mailer",Estimated by Ambition Box,100000,750000,1,Range (X-Y yrs)
Data Analyst | Mumbai,Hindco Recruitment Consultants,4-9 Yrs,4,9,₹ 0.13 - 38.85L/yr (AmbitionBox estimate),"Navi Mumbai, Thane, Mumbai",22,Naukri,0,0,"Data Transformation, Matplotlib, Data Research",Estimated by Ambition Box,13000,3885000,1,Range (X-Y yrs)
Data Analyst,Bsharp Sales Enablers,1-3 Yrs,1,3,Not Disclosed,Bangalore / Bengaluru,365,Naukri,3.8,6,"User management, Data Analyst, Usage",Unknown,360000,1330000,0,Range (X-Y yrs)
Frontend Data Analyst,Ultimez Technology Pvt Ltd,10-15 Yrs,10,15,Not Disclosed,Remote,365,Naukri,3.6,8,"Javascript, Web development, Agile",Unknown,360000,1330000,0,Range (X-Y yrs)
Senior Data Analyst - Retail/FMCG (3-6 yrs),Zyoin Group,3-6 Yrs,3,6,Not Disclosed,Bangalore / Bengaluru,30,iimjobs,4,1,"Data Analytics, Analytics, Data Modeling",Unknown,360000,1330000,0,Range (X-Y yrs)
Lead Data Analyst - Pricing & Revenue Management (7-10 yrs),CxSearch Global Partners,7-10 Yrs,7,10,Not Disclosed,"Mumbai, Bangalore / Bengaluru",23,iimjobs,0,0,"Analytics, Data Analytics, Python",Unknown,360000,1330000,0,Range (X-Y yrs)
Lead - Data Analyst - Global Logistics Industry (7-11 yrs),Cxsearch Global Partners,7-11 Yrs,7,11,Not Disclosed,Bangalore / Bengaluru,23,iimjobs,0,0,"Analytics, Data Analytics, SQL",Unknown,360000,1330000,0,Range (X-Y yrs)
Data Analyst_ MNC Bank_ Bengaluru,Novel Financial Solutions,3-8 Yrs,3,8,₹ 10 - 20L/yr,"Chennai, Bangalore / Bengaluru",23,Naukri,0,0,"Control Testing Automation, SAS, Shell Scripting",Salary Listed by Company,1000000,2000000,1,Range (X-Y yrs)
Data Analyst,Jobs Desk,2-5 Yrs,2,5,₹ 3 - 4L/yr,New Delhi,23,Naukri,0,0,Advanced Excel,Salary Listed by Company,300000,400000,1,Range (X-Y yrs)
Data Analyst,Comaea Consulting,3-8 Yrs,3,8,₹ 10 - 12L/yr,Mumbai,23,Naukri,0,0,"Business Intelligence, Power Bi, Tableau",Salary Listed by Company,1000000,1200000,1,Range (X-Y yrs)
Data Analyst - Python & Pyspark,D2N SOLUTIONS,3-4 Yrs,3,4,₹ 0.2 - 27L/yr (AmbitionBox estimate),New Delhi,23,Naukri,0,0,"HR Generalist, HRBP, Data Analyst",Estimated by Ambition Box,20000,2700000,1,Range (X-Y yrs)
Data Analyst - Python & Pyspark,D2N SOLUTIONS,5-10 Yrs,5,10,Not Disclosed,Bangalore Rural,23,Naukri,0,0,"Pyspark, Java, Scala",Unknown,220000,1500000,0,Range (X-Y yrs)
Data Analyst - Python & Pyspark,D2N SOLUTIONS,5-10 Yrs,5,10,Not Disclosed,Hyderabad / Secunderabad,23,Naukri,0,0,"Pyspark, Java, Scala",Unknown,220000,1500000,0,Range (X-Y yrs)
Sr. Data Analyst,Rudra Research And Analytics Llp,5-6 Yrs,5,6,₹ 6 - 6.5L/yr,Pune,23,Naukri,0,0,"Data Validation, Pivot Table, Power Bi",Salary Listed by Company,600000,650000,1,Range (X-Y yrs)
Data Analyst - Python & Pyspark,D2N SOLUTIONS,5-10 Yrs,5,10,Not Disclosed,Pune,23,Naukri,0,0,"Pyspark, Java, Scala",Unknown,220000,1500000,0,Range (X-Y yrs)
DATA Analyst/ Python Scripting/ Pyspark & SQL,D2N SOLUTIONS,6-11 Yrs,6,11,Not Disclosed,Bangalore Rural,23,Naukri,0,0,"Pyspark, Cloud, Bi Tools",Unknown,220000,1500000,0,Range (X-Y yrs)
Data Analyst - Python & Pyspark,D2N SOLUTIONS,5-10 Yrs,5,10,Not Disclosed,Bangalore Rural,23,Naukri,0,0,"Pyspark, Scala, Data Analysis",Unknown,220000,1500000,0,Range (X-Y yrs)
Data Analyst - Python & Pyspark,D2N SOLUTIONS,5-10 Yrs,5,10,Not Disclosed,Hyderabad / Secunderabad,23,Naukri,0,0,"Pyspark, Java, Scala",Unknown,220000,1500000,0,Range (X-Y yrs)
Data  Analyst - Python Scripting / PySpark & SQL,D2N SOLUTIONS,6-11 Yrs,6,11,₹ 2.95 - 12.1L/yr (AmbitionBox estimate),Pune,23,Naukri,0,0,"DWH, Power BI, Python Scripting",Estimated by Ambition Box,295000,1210000,1,Range (X-Y yrs)
Data Analyst - OWS,D2N SOLUTIONS,5-9 Yrs,5,9,₹ 2.2 - 15L/yr (AmbitionBox estimate),Pune,23,Naukri,0,0,"Screening, EDQ, Oracle Watch",Estimated by Ambition Box,220000,1500000,1,Range (X-Y yrs)
Sr Data Analyst- SQL,ARA Resources,5-10 Yrs,5,10,₹ 12 - 20L/yr,Bangalore / Bengaluru,23,Naukri,0,0,"QC, Data Analysis, SQL Queries",Salary Listed by Company,1200000,2000000,1,Range (X-Y yrs)
Business Analytics,Symbiosis Management Consultants,8-13 Yrs,8,13,Not Disclosed,Mumbai,23,Naukri,0,0,"AZURE, MACHINE LEARNING, CLOUD",Unknown,10000,6000000,0,Range (X-Y yrs)
MIS / Data Analyst,Kmspl Services,3-8 Yrs,3,8,₹ 4 - 4.75L/yr,Bhubaneshwar,23,Naukri,0,0,"MIS, MIS Operations, Data Management",Salary Listed by Company,400000,475000,1,Range (X-Y yrs)
Data Analyst,Ducker Worldwide Management Consulting Pvt. Ltd,1-3 Yrs,1,3,Not Disclosed,Bangalore / Bengaluru,60,Naukri,3.9,5,"Consulting, Market research, Analytics",Unknown,360000,1330000,0,Range (X-Y yrs)
Looking For Data Analyst (Qualtrics & SAP SuccessFactors),CDI Solutions,3-5 Yrs,3,5,₹ 1.25 - 37L/yr (AmbitionBox estimate),Bangalore / Bengaluru,24,Naukri,0,0,"Excel, business intelligence platforms, Power BI",Estimated by Ambition Box,125000,3700000,1,Range (X-Y yrs)
Data analyst,iProPal (ALLPS),1-3 Yrs,1,3,Not Disclosed,Remote,24,Naukri,0,0,"Data analytics, Data Analyst, Internship",Unknown,360000,1330000,0,Range (X-Y yrs)
Data Analyst,HealthSy,1-3 Yrs,1,3,Not Disclosed,Coimbatore,24,Naukri,0,0,"Backend, Data analysis, Data management",Unknown,360000,1330000,0,Range (X-Y yrs)
Sr. Data Analysts,EGO FLOORING PVT. LTD.,2-6 Yrs,2,6,Not Disclosed,India,1460,Naukri,3.3,12,"Consulting, Industry research, Management",Unknown,360000,1330000,0,Range (X-Y yrs)
"Sr. Data Analysts,",NAVEDAS TECHNOLOGY SOLUTIONS PRIVATE LIMITED,1-6 Yrs,1,6,Not Disclosed,"Chennai, Pune, New Delhi
													+4 more",1460,Naukri,3.8,6,"Consulting, Recruitment, Industry research",Unknown,360000,1330000,0,Range (X-Y yrs)
Need JD Edwards Financial Data Analyst (for 3 year contract),Rankskills Knowledge International,6-11 Yrs,6,11,Not Disclosed,"Doha, Qatar",24,Naukri,0,0,"Visualization, Financial Reporting, Financial Analytics",Unknown,360000,1330000,0,Range (X-Y yrs)
Business Analyst  In Bpo,Subhadra Jobs Consultancy,6-11 Yrs,6,11,₹ 4 - 9L/yr,Bangalore Rural,24,Naukri,0,0,"Excel, Business Analytics, Data Manipulation",Salary Listed by Company,400000,900000,1,Range (X-Y yrs)
Data Analyst/Senior Data Analyst - Denodo Platform (3-8 yrs),HeadPro Consulting LLP,3-8 Yrs,3,8,Not Disclosed,Bangalore / Bengaluru,60,hirist,0,0,"Data Analyst, Data Visualization, Data Governance",Unknown,360000,1330000,0,Range (X-Y yrs)
Data Analyst,Randstad,1-5 Yrs,1,5,₹ 0.094 - 37L/yr (AmbitionBox estimate),"Mumbai suburbs, Mumbai, Mumbai",25,Naukri,0,0,"Excel, Google Suite, Data Analysis",Estimated by Ambition Box,9400,3700000,1,Range (X-Y yrs)
Senior Executive - Data Analyst,HDI outsourcing Services Private Limited,6-8 Yrs,6,8,₹ 4 - 6L/yr,Faridabad,25,Naukri,0,0,"Excel, Data Analysis, MS Office",Salary Listed by Company,400000,600000,1,Range (X-Y yrs)
Sr. Azure Data Analyst,Fusemachines,3-7 Yrs,3,7,Not Disclosed,Pune,60,Naukri,5,1,"SQL, MySQL, Project management",Unknown,360000,1330000,0,Range (X-Y yrs)
Data analyst trainer,Merida Tech Minds (opc),1-6 Yrs,1,6,₹ 1 - 1.5L/yr,Bangalore / Bengaluru,25,Naukri,0,0,"Data Analysis, Teaching skills",Salary Listed by Company,100000,150000,1,Range (X-Y yrs)
Data Analyst professionals are required,Saino Koyo Consulting,5-10 Yrs,5,10,₹ 20 - 32.5L/yr,Hyderabad / Secunderabad,25,Naukri,0,0,"Analytical Skills, Excellent Communication In English, Data Analysis",Salary Listed by Company,2000000,3250000,1,Range (X-Y yrs)
Big Data Engineer - AWS Platform (5-10 yrs),TCCS,5-10 Yrs,5,10,Not Disclosed,"Bangalore / Bengaluru, Gurgaon / Gurugram",30,hirist,1.8,10,"Big Data, AWS, Data Warehousing",Unknown,360000,1330000,0,Range (X-Y yrs)
Urgent Hiring For Digital Marketing Analyst with a Product based MNC,Peoplefy Infosolutions,4-9 Yrs,4,9,Not Disclosed,Pune,25,Naukri,0,0,"Powerbi, Digital Marketing Analyst, Data Analyst",Unknown,360000,1330000,0,Range (X-Y yrs)
Business Analyst,Nexpro247,0-5 Yrs,0,5,Not Disclosed,"Chennai, Pune, Mumbai",25,Naukri,0,0,"automation framework, python, analytical",Unknown,360000,1330000,0,Range (X-Y yrs)
Data Analyst,Indian Internet Solutions,1-3 Yrs,1,3,Not Disclosed,Aurangabad,30,Naukri,2.8,4,Data Analyst,Unknown,360000,1330000,0,Range (X-Y yrs)
G.M (Sales & Marketing),Damden Properties,10-15 Yrs,10,15,Not Disclosed,Bangalore / Bengaluru,2190,Naukri,5,2,"Customer service, Client servicing, Report generation",Unknown,360000,1330000,0,Range (X-Y yrs)
Senior Data Analyst - AWS,Expedite Technology Solutions LLC,2-4 Yrs,2,4,Not Disclosed,Bangalore / Bengaluru,270,Naukri,5,2,"Senior Data Analyst, AWS, Data analysis",Unknown,360000,1330000,0,Range (X-Y yrs)
Data Analyst,NIG SOFTWARE SOLUTION,3-8 Yrs,3,8,Not Disclosed,Salem,150,Naukri,5,2,"Troubleshooting, Data analysis, Consulting",Unknown,360000,1330000,0,Range (X-Y yrs)
Informatica Data Analyst - Data Quality (6-10 yrs),RapidBraiins,6-10 Yrs,6,10,Not Disclosed,Bangalore / Bengaluru,26,hirist,0,0,"Data Quality, Informatica, Data Analyst",Unknown,360000,1330000,0,Range (X-Y yrs)
Manager - Data Analyst - MR Firm (7-9 yrs),iTaap,7-9 Yrs,7,9,Not Disclosed,"Mumbai, Gurgaon / Gurugram",60,iimjobs,5,1,"Analytics, Data Analytics, Data Management",Unknown,360000,1330000,0,Range (X-Y yrs)
Data Analyst - TSI,BP INCORPORATE INTERNATIONAL.,1-3 Yrs,1,3,Not Disclosed,Pune,26,Naukri,0,0,"SAP, Manager Quality Assurance, Maximo",Unknown,360000,1330000,0,Range (X-Y yrs)
Data Analyst - (For Warehouse OPs) at Andher East.,Job Search,2-7 Yrs,2,7,₹ 0.16 - 1.45L/yr (AmbitionBox estimate),Mumbai,26,Naukri,0,0,"Sales Dashboard, Power Bi, Coding",Estimated by Ambition Box,16000,145000,1,Range (X-Y yrs)
Online Data Analyst-ETL,Resource Infrastructure Management India,6-8 Yrs,6,8,₹ 8 - 12L/yr,Bangalore / Bengaluru,26,Naukri,0,0,"Azure, API, ETL",Salary Listed by Company,800000,1200000,1,Range (X-Y yrs)
Data Analyst,Collabera Technologies,5-10 Yrs,5,10,₹ 2 - 28L/yr (AmbitionBox estimate),Bangalore / Bengaluru,26,Naukri,0,0,"SQL Queries, Informatica, Data Warehousing",Estimated by Ambition Box,200000,2800000,1,Range (X-Y yrs)
Warehouse Operations & Data Analysis-MNC into Supply Chain,Nexus Manpower Solutions,3-8 Yrs,3,8,₹ 6.5 - 8L/yr,Bangalore / Bengaluru,26,Naukri,0,0,"data analysis, supply chain, hub operations",Salary Listed by Company,650000,800000,1,Range (X-Y yrs)
Data Analyst,Fedelty Healthcare Pvt Ltd,0-2 Yrs,0,2,₹ 1 - 2.25L/yr,Mumbai,26,Naukri,0,0,"Analytical Skills, Data Mining, Data Cleansing",Salary Listed by Company,100000,225000,1,Range (X-Y yrs)
Data Analyst,Sea and Beyond,1-4 Yrs,1,4,Not Disclosed,Mumbai,26,Naukri,0,0,"Data analysis, tableau, Maritime",Unknown,360000,1330000,0,Range (X-Y yrs)
Azure Data Analyst,Ascendion Engineering,4-7 Yrs,4,7,₹ 0.3 - 9.5L/yr (AmbitionBox estimate),"Chennai, Pune, Bangalore / Bengaluru",26,Naukri,0,0,"azure cost management, Azure, data analysis",Estimated by Ambition Box,30000,950000,1,Range (X-Y yrs)
Senior Data Analyst - Reporting & Visualization (5-8 yrs),Seikor,5-8 Yrs,5,8,Not Disclosed,Hyderabad / Secunderabad,27,hirist,0,0,"Data Analyst, Data Analytics, Data Visualization",Unknown,360000,1330000,0,Range (X-Y yrs)
Software Engineer/Data Analyst - R/Python (4-8 yrs),Cryzdal,4-8 Yrs,4,8,Not Disclosed,Haryana,60,hirist,5,1,"Data Analyst, Python, R",Unknown,360000,1330000,0,Range (X-Y yrs)
Convosight - Senior Data Analyst - Power BI/Tableau (5-7 yrs),Convosight,5-7 Yrs,5,7,Not Disclosed,"Mumbai, Bangalore / Bengaluru, Gurgaon / Gurugram",60,hirist,2.7,19,"Data Analyst, Data Analytics, Power BI",Unknown,360000,1330000,0,Range (X-Y yrs)
Data Analyst - Apparel Industry@Noida,Talentzq,3-6 Yrs,3,6,₹ 8 - 9.5L/yr,Noida,27,Naukri,0,0,"Retail Analytics, Power Bi, Data Visualization",Salary Listed by Company,800000,950000,1,Range (X-Y yrs)
HR Data Analyst,Peoplefy Infosolutions,6-11 Yrs,6,11,Not Disclosed,Navi Mumbai,27,Naukri,0,0,"Excel, Power Bi, Data Analysis",Unknown,360000,1330000,0,Range (X-Y yrs)
GBS Material Master Data Analyst (MDM),Smith & Nephew,5-10 Yrs,5,10,Not Disclosed,Pune,27,Naukri,0,0,"Equity, SAP, Informatica",Unknown,360000,1330000,0,Range (X-Y yrs)
Data Analyst,Transformatrix Global,5-10 Yrs,5,10,₹ 5 - 10L/yr,Bangalore Rural,27,Naukri,0,0,"Data Science, Data Mining, Data Analytics",Salary Listed by Company,500000,1000000,1,Range (X-Y yrs)
Data Analyst,The IT Mind,5-10 Yrs,5,10,Not Disclosed,Chennai,270,Naukri,3.1,10,"SQL, Agile, Scrum",Unknown,360000,1330000,0,Range (X-Y yrs)
Data Analyst,Nurture Software Solutions Pvt Ltd,3-6 Yrs,3,6,Not Disclosed,Bangalore / Bengaluru,365,Naukri,1.7,34,"Manager Quality Control, Analytical, Operations",Unknown,360000,1330000,0,Range (X-Y yrs)
Business Analyst/ Data Analyst,Aptus Data Labs,2-7 Yrs,2,7,Not Disclosed,Bangalore / Bengaluru,365,Naukri,2.7,4,"CRM, SQL, SMS",Unknown,360000,1330000,0,Range (X-Y yrs)
Data Analyst,Tentacle solutions,8-13 Yrs,8,13,Not Disclosed,Remote,730,Naukri,4.1,3,"Javascript, Jquery, Css",Unknown,360000,1330000,0,Range (X-Y yrs)
Data Analyst,Billow People Services,1-3 Yrs,1,3,₹ 0.1 - 45L/yr (AmbitionBox estimate),Bangalore / Bengaluru,27,Naukri,0,0,"SQL Queries, ETL, Python",Estimated by Ambition Box,10000,4500000,1,Range (X-Y yrs)
Data Analyst - SQL/Azure (3-6 yrs),GM INFOTECH,3-6 Yrs,3,6,Not Disclosed,"Mumbai, Navi Mumbai",60,hirist,4.4,2,"Data Analyst, SQL, Power BI",Unknown,360000,1330000,0,Range (X-Y yrs)
Data Analyst - MIS - Mutual Fund (5-6 yrs),Arin Consultancy Pvt. Ltd.,5-6 Yrs,5,6,Not Disclosed,Mumbai,30,iimjobs,3,1,"Analytics, Data Analytics, Consulting - BFSI",Unknown,360000,1330000,0,Range (X-Y yrs)
Data Analyst,Valocity,1-4 Yrs,1,4,Not Disclosed,New Delhi,30,Naukri,2.3,6,"Data Analyst, Troubleshooting, Analytics",Unknown,360000,1330000,0,Range (X-Y yrs)
Solution Manager - Power BI (7-10 yrs),GM INFOTECH,7-10 Yrs,7,10,Not Disclosed,Pune,60,hirist,4.4,2,"Power BI, Data Analyst, Solution Design",Unknown,360000,1330000,0,Range (X-Y yrs)
Data Processing Analyst - Research Operations,Savanta,1-4 Yrs,1,4,Not Disclosed,"New Delhi, Noida",1095,Naukri,3.5,7,"Career development, Data analysis, Diversity and Inclusion",Unknown,360000,1330000,0,Range (X-Y yrs)
Senior Qualtrics Data Analyst,Anika Technologies,7-10 Yrs,7,10,₹ 3.24 - 28L/yr (AmbitionBox estimate),Bangalore / Bengaluru,29,Naukri,0,0,"Data Manipulation, Implementing Data Models, SAP CRM",Estimated by Ambition Box,324000,2800000,1,Range (X-Y yrs)
Online Data Analyst -ETL,Ontrack Hr Services,6-8 Yrs,6,8,₹ 15 - 18L/yr,Bangalore / Bengaluru,29,Naukri,0,0,"Data Automation, Cloud Platforms, Api Integration",Salary Listed by Company,1500000,1800000,1,Range (X-Y yrs)
Data Analyst,SKY Jobs Hr Services,5-10 Yrs,5,10,₹ 12 - 22L/yr,"Chennai, Pune, Bangalore Rural
													+1 more",29,Naukri,0,0,"SAS, Power Bi, ANMF",Salary Listed by Company,1200000,2200000,1,Range (X-Y yrs)
Financial Data Analyst || Hybrid || Bangalore,Sunrise Job Consultancy,1-6 Yrs,1,6,₹ 1 - 6L/yr,Bangalore / Bengaluru,29,Naukri,0,0,"Financial Analysis, Excel, Accounting",Salary Listed by Company,100000,600000,1,Range (X-Y yrs)
Business Analyst in Data Analytics,Mount Talent Consulting,3-8 Yrs,3,8,₹ 5.5 - 15L/yr,Chennai,29,Naukri,0,0,"Data Modelling, Business Analyst, VBA",Salary Listed by Company,550000,1500000,1,Range (X-Y yrs)
Data Analyst | Forecasting | Power BI | WFH | US MNC | Gurgaon,Impetus Consultants,3-8 Yrs,3,8,₹ 4.5 - 8.5L/yr,Gurgaon / Gurugram,29,Naukri,0,0,"Data Science, Power BI, Capacity Planning",Salary Listed by Company,450000,850000,1,Range (X-Y yrs)
Data Analyst - US MNC (analytics),Aspyra Hr Services,3-8 Yrs,3,8,₹ 15 - 30L/yr,"Bangalore / Bengaluru, Hyderabad / Secunderabad",29,Naukri,0,0,"Business Intelligence, hql, Business Analytics",Salary Listed by Company,1500000,3000000,1,Range (X-Y yrs)
Data Analyst,ELEVATE Global,1-3 Yrs,1,3,Not Disclosed,Bangalore / Bengaluru,60,Naukri,4.2,3,"Consulting, Market research, Analytics",Unknown,360000,1330000,0,Range (X-Y yrs)
Senior IT Data Analyst - Data Visualization Tools (3-15 yrs),Dotflick Solutions,3-15 Yrs,3,15,Not Disclosed,"Guwahati, Orrisa, Patiala
													+10 more",30,hirist,0,0,"Big Data, Data Analyst, Data Analytics",Unknown,360000,1330000,0,Range (X-Y yrs)
